{
  "product": "Aegis",
  "displayName": "Aegis WebView",
  "version": "2.2.0-beta.52",
  "versionCode": 20251,
  "windows": {
    "packageIdentity": "Aegis.Project.AegisWebView",
    "executable": "Aegis.Windows.App.exe",
    "architecture": [
      "x64"
    ],
    "distribution": "inno-setup-exe",
    "runtime": "webview2-evergreen"
  },
  "android": {
    "applicationId": "com.aegis.browser",
    "distribution": [
      "direct-apk"
    ],
    "engine": "android-webview-adapter"
  },
  "updateManifest": {
    "schema": 1,
    "signature": "ed25519",
    "hash": "sha256",
    "status": "planned"
  }
}
